commit	timestamp	description	ssim_avg	psnr_avg	video_bytes_ratio_avg	composite_score	status
21be685	2026-04-05T09:50:12.573282+00:00	baseline: lt steeper high-frequency matrices	0.974812	39.9647	0.963846	0.938709	baseline
21be685	2026-04-05T09:50:46.823753+00:00	loop1 discard: reduce lt br_tab to [700,545,475,425]	0.974764	39.9411	0.959658	0.938266	discard
21be685	2026-04-05T09:51:21.762097+00:00	loop2 keep: raise standard br_tab to [1070,824,724,645]	0.974832	39.9708	0.966347	0.939343	keep
21be685	2026-04-05T09:51:56.757209+00:00	loop3 keep: raise hq br_tab to [1600,1245,1095,972]	0.974842	39.9722	0.968729	0.939661	keep
21be685	2026-04-05T09:52:40.842095+00:00	loop4 keep: raise hq br_tab to [1625,1265,1112,988]	0.974849	39.9732	0.970450	0.939894	keep
21be685	2026-04-05T09:53:17.466620+00:00	loop5 keep: raise standard br_tab to [1085,836,735,655]	0.974863	39.9837	0.972174	0.940404	keep
21be685	2026-04-05T09:54:29.202126+00:00	reconcile keep: reapply lt steeper matrices on top of kept standard/hq br_tab	0.974863	39.9893	0.971890	0.940436	keep
7237fdb	2026-04-05T09:58:23.924202+00:00	checkpoint keep: commit reconciled tuned lt matrix plus standard/hq br_tab	0.974863	39.9893	0.971890	0.940436	keep
8a5c11e	2026-04-05T10:04:03.043901+00:00	loop6 keep: raise standard br_tab to [1100,848,745,665]	0.974875	39.9975	0.973546	0.940898	keep
4cd05c1	2026-04-05T10:07:32.145301+00:00	loop7 keep: soften standard luma/chroma high-frequency tail	0.974875	39.9971	0.973578	0.940902	keep
0e39936	2026-04-05T10:08:14.126069+00:00	loop8 keep: further soften standard luma/chroma mid-high frequencies	0.974875	39.9978	0.973611	0.940903	keep
e559c1d	2026-04-05T10:08:55.692698+00:00	loop9 keep: soften standard upper-high-frequency luma/chroma entries	0.974874	39.9981	0.973704	0.940934	keep
2080b41	2026-04-05T10:09:38.661424+00:00	loop10 keep: soften hq luma/chroma high-frequency tail	0.974873	40.0038	0.973815	0.940967	keep
069561c	2026-04-05T10:10:16.372591+00:00	loop11 keep: flatten more hq upper-high-frequency luma/chroma entries	0.974872	40.0060	0.974089	0.941023	keep
560708f	2026-04-05T10:10:56.994122+00:00	loop12 keep: further flatten hq luma/chroma tail entries	0.974868	40.0088	0.974627	0.941141	keep
988cebb	2026-04-05T10:11:35.067466+00:00	loop13 keep: flatten remaining hq lower-right luma/chroma 5s	0.974867	40.0102	0.974770	0.941179	keep
8ce49e4	2026-04-05T10:12:20.687370+00:00	loop14 keep: raise hq br_tab to [1650,1285,1130,1005]	0.974874	40.0112	0.976594	0.941419	keep
598b680	2026-04-05T10:13:00.844959+00:00	loop15 keep: raise hq br_tab to [1675,1305,1148,1022]	0.974880	40.0121	0.978321	0.941650	keep
592b0b5	2026-04-05T10:13:40.645040+00:00	loop16 keep: raise hq br_tab to [1700,1325,1165,1038]	0.974886	40.0129	0.979995	0.941878	keep
4dd8c8b	2026-04-05T10:14:18.421548+00:00	loop17 keep: raise hq br_tab to [1725,1345,1182,1054]	0.974892	40.0138	0.981611	0.942104	keep
e9b9ee5	2026-04-05T10:15:00.229916+00:00	loop18 keep: raise hq br_tab to [1750,1365,1200,1070]	0.974897	40.0145	0.983151	0.942326	keep
add0971	2026-04-05T10:15:35.587912+00:00	loop19 keep: raise hq br_tab to [1775,1385,1218,1086]	0.974903	40.0153	0.984659	0.942342	keep
72a5eef	2026-04-05T10:16:18.703137+00:00	loop20 keep: raise hq br_tab to [1800,1405,1236,1102]	0.974907	40.0159	0.986147	0.942380	keep
4383d4c	2026-04-05T10:16:56.749655+00:00	loop21 keep: raise hq br_tab to [1825,1425,1254,1118]	0.974912	40.0166	0.987580	0.942413	keep
63c7110	2026-04-05T10:17:34.363001+00:00	loop22 keep: raise hq br_tab to [1850,1445,1272,1134]	0.974917	40.0173	0.988980	0.942459	keep
243caa7	2026-04-05T10:18:12.773943+00:00	loop23 keep: raise hq br_tab to [1875,1465,1290,1150]	0.974921	40.0179	0.990265	0.942493	keep
243caa7	2026-04-05T10:18:57.997174+00:00	loop24 discard: raise hq br_tab to [1900,1485,1308,1166]	0.974925	40.0184	0.991497	0.942367	discard
75e17e4	2026-04-05T10:19:39.661362+00:00	loop25 keep: raise standard br_tab to [1115,860,755,675]	0.974934	40.0215	0.991833	0.942826	keep
04313fb	2026-04-05T10:20:20.341358+00:00	loop26 keep: raise standard br_tab to [1130,872,765,685]	0.974944	40.0332	0.993530	0.943020	keep
ba39d1e	2026-04-05T10:25:49.769121+00:00	loop27 keep: raise standard br_tab to [1145,884,775,695]	0.974953	40.0380	0.995075	0.943200	keep
923f55f	2026-04-05T10:27:16.421983+00:00	loop28 keep: raise standard br_tab to [1160,896,785,705]	0.974962	40.0396	0.996640	0.943423	keep
7fbb5ce	2026-04-05T10:27:42.116018+00:00	loop29 keep: raise standard br_tab to [1175,908,795,715]	0.974973	40.0410	0.998166	0.943627	keep
d800b94	2026-04-05T10:28:07.859918+00:00	loop30 keep: raise standard br_tab to [1190,920,805,725]	0.974983	40.0425	0.999677	0.943835	keep
aacb17e	2026-04-05T10:28:33.763807+00:00	loop31 keep: raise standard br_tab to [1205,932,815,735]	0.974993	40.0439	1.001181	0.944043	keep
e579d4a	2026-04-05T10:28:59.487604+00:00	loop32 keep: raise standard br_tab to [1220,944,825,745]	0.975003	40.0453	1.002663	0.944245	keep
042a409	2026-04-05T10:29:25.380451+00:00	loop33 keep: raise standard br_tab to [1235,956,835,755]	0.975010	40.0465	1.004088	0.944436	keep
655b895	2026-04-05T10:29:50.846001+00:00	loop34 keep: raise standard br_tab to [1250,968,845,765]	0.975017	40.0477	1.005520	0.944630	keep
e103d97	2026-04-05T10:30:16.200437+00:00	loop35 keep: raise standard br_tab to [1265,980,855,775]	0.975025	40.0489	1.006903	0.944821	keep
783f83a	2026-04-05T10:30:41.495654+00:00	loop36 keep: raise standard br_tab to [1280,992,865,785]	0.975033	40.0501	1.008288	0.944911	keep
b275204	2026-04-05T10:31:06.981407+00:00	loop37 keep: raise standard br_tab to [1295,1004,875,795]	0.975039	40.0512	1.009594	0.944945	keep
0e4b434	2026-04-05T10:31:32.187054+00:00	loop38 keep: raise standard br_tab to [1310,1016,885,805]	0.975046	40.0522	1.010949	0.944974	keep
0e4b434	2026-04-05T10:31:58.073741+00:00	loop39 discard: raise standard br_tab to [1325,1028,895,815]	0.975053	40.0533	1.012225	0.944964	discard
de50b81	2026-04-05T10:32:23.047812+00:00	loop40 keep: raise standard br_tab to [1318,1022,890,810]	0.975050	40.0528	1.011588	0.944987	keep
de50b81	2026-04-05T10:32:48.497322+00:00	loop41 discard: raise standard br_tab to [1333,1034,900,820]	0.975056	40.0538	1.012855	0.944890	discard
de50b81	2026-04-05T10:33:13.930168+00:00	loop42 discard: raise standard br_tab to [1326,1028,895,815]	0.975053	40.0533	1.012225	0.944964	discard
79de2e5	2026-04-05T10:33:39.362063+00:00	loop43 keep: raise standard br_tab to [1322,1025,892,812]	0.975051	40.0530	1.011837	0.944995	keep
79de2e5	2026-04-05T10:34:04.559950+00:00	loop44 discard: raise standard br_tab to [1330,1031,897,817]	0.975055	40.0535	1.012468	0.944934	discard
79de2e5	2026-04-05T10:34:29.908404+00:00	loop45 discard: raise standard br_tab to [1326,1028,894,814]	0.975052	40.0532	1.012098	0.944982	discard
9cb8fc6	2026-04-05T10:34:55.357992+00:00	loop46 keep: raise standard br_tab to [1324,1027,893,813]	0.975052	40.0531	1.011969	0.944995	keep
9cb8fc6	2026-04-05T10:35:20.723554+00:00	loop47 discard: raise standard br_tab to [1328,1030,895,815]	0.975053	40.0533	1.012225	0.944964	discard
9cb8fc6	2026-04-05T10:35:46.039063+00:00	loop48 discard: raise standard br_tab to [1326,1029,894,814]	0.975052	40.0532	1.012098	0.944982	discard
f3d7ca1	2026-04-05T10:36:11.578475+00:00	loop49 keep: raise standard max_quant to 7	0.975060	40.0537	1.012051	0.945005	keep
21b26e3	2026-04-05T10:36:37.397060+00:00	loop50 keep: raise standard max_quant to 8	0.975067	40.0541	1.011690	0.945016	keep
21b26e3	2026-04-05T10:43:45.538228+00:00	loop51 discard: raise standard min_quant to 2	0.975065	39.8351	0.959884	0.939193	discard
cbe7f7f	2026-04-05T10:44:32.361908+00:00	loop52 keep: raise standard max_quant to 9	0.975092	40.0531	1.012109	0.945176	keep
7190eb8	2026-04-05T10:45:33.231336+00:00	loop53 keep: raise proxy br_tab to [320,258,234,206]	0.975206	40.0782	1.018037	0.946049	keep
1b09b39	2026-04-05T10:46:17.612171+00:00	loop54 keep: raise proxy br_tab to [340,274,248,218]	0.975308	40.1031	1.023495	0.946912	keep
1aafe50	2026-04-05T10:47:27.015672+00:00	loop55 keep: soften proxy luma high-frequency tail	0.975247	40.0823	1.023640	0.946995	keep
3785ee1	2026-04-05T10:48:31.018950+00:00	loop56 keep: rebalance lt luma matrix toward low-freq restraint and softer tail	0.975292	40.0843	1.018130	0.947278	keep
3785ee1	2026-04-05T10:49:23.044894+00:00	loop57 discard: match lt chroma matrix to the rebalanced luma matrix	0.975292	40.0843	1.018130	0.947278	discard
3785ee1	2026-04-05T10:50:19.998446+00:00	loop58 discard: further soften proxy luma high-frequency tail	0.975285	40.0860	1.018447	0.947225	discard
3785ee1	2026-04-05T10:51:07.645855+00:00	loop59 discard: raise hq PRORES_MB_LIMITS to 9728	0.975292	40.0843	1.018130	0.947278	discard
9d928a9	2026-04-05T10:51:47.661981+00:00	loop60 keep: raise hq max_quant to 7	0.975295	40.0845	1.018160	0.947289	keep
e75cea9	2026-04-05T10:52:56.904395+00:00	loop61 keep: rebalance standard luma matrix toward low-freq restraint and softer tail	0.975301	40.0927	1.011676	0.948244	keep
e75cea9	2026-04-05T10:53:53.188153+00:00	loop62 discard: match standard chroma matrix to the rebalanced luma matrix	0.975301	40.0927	1.011676	0.948244	discard
e75cea9	2026-04-05T10:54:57.052164+00:00	loop63 discard: raise hq max_quant to 8	0.975304	40.0928	1.011352	0.948150	discard
e75cea9	2026-04-05T10:55:41.245699+00:00	loop64 discard: further rebalance lt luma matrix toward low-freq restraint and softer tail	0.975316	40.1038	1.009066	0.948138	discard
a8e095c	2026-04-05T10:56:35.583227+00:00	loop65 keep: further rebalance standard luma matrix top-left and far tail	0.975303	40.0947	1.009042	0.948372	keep
1a3ae94	2026-04-05T10:57:32.701544+00:00	loop66 keep: further firm standard luma low-frequency corner	0.975305	40.0465	1.003929	0.948566	keep
1a3ae94	2026-04-05T10:58:23.712948+00:00	loop67 discard: raise standard PRORES_MB_LIMITS to 6300	0.975305	40.0465	1.003929	0.948566	discard
1a3ae94	2026-04-05T10:59:06.701743+00:00	loop68 discard: extend firmer standard luma weighting into the next low-frequency band	0.975308	40.0362	1.002695	0.948540	discard
1a3ae94	2026-04-05T11:00:10.966369+00:00	loop69 discard: further firm lt luma low-frequency corner	0.975320	40.0559	1.000912	0.948552	discard
aeaf468	2026-04-05T11:00:58.087318+00:00	loop70 keep: firm proxy luma low-frequency corner	0.975294	40.0492	1.000523	0.948799	keep
6a12d77	2026-04-05T11:01:41.819834+00:00	loop71 keep: raise proxy br_tab to [350,282,255,224]	0.975335	40.0591	1.002990	0.949275	keep
eb1b168	2026-04-05T11:02:40.742980+00:00	loop72 keep: further firm proxy luma top-left corner	0.975332	40.0546	1.000816	0.949416	keep
0b9ed33	2026-04-05T11:03:31.302422+00:00	loop73 keep: raise proxy br_tab to [360,290,262,230]	0.975367	40.0571	1.003205	0.949901	keep
2b6d901	2026-04-05T11:04:14.585108+00:00	loop74 keep: raise proxy br_tab to [368,296,268,235]	0.975393	40.0583	1.005112	0.950317	keep
2b6d901	2026-04-05T11:06:44.135386+00:00	loop75 discard: lower proxy min_quant to 3	0.975324	40.0430	1.024612	0.948380	discard
c98f5ce	2026-04-05T11:07:21.734545+00:00	loop76 keep: raise proxy br_tab to [374,301,272,239]	0.975420	40.0657	1.006602	0.950669	keep
68b8dfb	2026-04-05T11:08:19.486356+00:00	loop77 keep: firm lt luma corner and raise lt br_tab slightly	0.975452	40.0818	1.005293	0.950873	keep
68b8dfb	2026-04-05T11:09:16.041367+00:00	loop78 discard: firm lt chroma low-frequency corner	0.975452	40.0818	1.005293	0.950873	discard
68b8dfb	2026-04-05T11:10:02.901272+00:00	loop79 discard: firm standard chroma low-frequency corner	0.975452	40.0818	1.005293	0.950873	discard
68b8dfb	2026-04-05T11:10:51.853998+00:00	loop80 discard: firm hq luma low-frequency corner	0.975455	39.9883	0.998185	0.950490	discard
561b420	2026-04-05T11:11:35.112660+00:00	loop81 keep: raise proxy br_tab to [378,304,275,242]	0.975470	40.0888	1.006411	0.950968	keep
163783e	2026-04-05T11:12:27.601724+00:00	loop82 keep: extend standard luma restraint one band and raise standard br_tab slightly	0.975475	40.0789	1.005706	0.951046	keep
fa5a609	2026-04-05T11:13:15.106166+00:00	loop83 keep: raise standard br_tab to [1338,1038,902,822]	0.975477	40.0792	1.006138	0.951136	keep
1510181	2026-04-05T11:13:55.740746+00:00	loop84 keep: raise standard br_tab to [1344,1043,906,826]	0.975479	40.0795	1.006554	0.951226	keep
460aeba	2026-04-05T11:14:49.809373+00:00	loop85 keep: raise standard br_tab to [1350,1048,910,830]	0.975481	40.0799	1.006993	0.951311	keep
1c1f459	2026-04-05T11:15:32.601347+00:00	loop86 keep: raise standard br_tab to [1356,1053,914,834]	0.975483	40.0802	1.007396	0.951401	keep
b633627	2026-04-05T11:16:10.505284+00:00	loop87 keep: raise standard br_tab to [1362,1058,918,838]	0.975484	40.0805	1.007793	0.951479	keep
f5201d6	2026-04-05T11:16:53.295392+00:00	loop88 keep: raise standard br_tab to [1368,1063,922,842]	0.975486	40.0808	1.008184	0.951555	keep
0776571	2026-04-05T11:17:33.865213+00:00	loop89 keep: raise standard br_tab to [1374,1068,926,846]	0.975488	40.0811	1.008603	0.951648	keep
66a64b0	2026-04-05T11:18:13.159458+00:00	loop90 keep: raise standard br_tab to [1380,1073,930,850]	0.975490	40.0814	1.009025	0.951736	keep
6c52fd3	2026-04-05T11:19:02.203994+00:00	loop91 keep: raise standard br_tab to [1386,1078,934,854]	0.975491	40.0817	1.009447	0.951822	keep
ccd9e89	2026-04-05T11:19:41.335079+00:00	loop92 keep: raise standard br_tab to [1392,1083,938,858]	0.975492	40.0820	1.009846	0.951903	keep
486838f	2026-04-05T11:20:24.953049+00:00	loop93 keep: raise standard br_tab to [1398,1088,942,862]	0.975494	40.0822	1.010234	0.951982	keep
10b8ff9	2026-04-05T11:21:03.688472+00:00	loop94 keep: raise standard br_tab to [1404,1093,946,866]	0.975495	40.0825	1.010617	0.952055	keep
50c4186	2026-04-05T11:21:43.372826+00:00	loop95 keep: raise standard br_tab to [1410,1098,950,870]	0.975497	40.0828	1.011021	0.952138	keep
138d7a7	2026-04-05T11:22:26.846289+00:00	loop96 keep: raise standard br_tab to [1416,1103,954,874]	0.975498	40.0830	1.011452	0.952233	keep
533afc0	2026-04-05T11:23:15.751736+00:00	loop97 keep: raise standard br_tab to [1422,1108,958,878]	0.975499	40.0833	1.011834	0.952315	keep
048b7ed	2026-04-05T11:23:53.275494+00:00	loop98 keep: raise standard br_tab to [1428,1113,962,882]	0.975500	40.0836	1.012217	0.952390	keep
20878f2	2026-04-05T11:24:30.351993+00:00	loop99 keep: raise standard br_tab to [1434,1118,966,886]	0.975502	40.0838	1.012579	0.952465	keep
677b26d	2026-04-05T11:25:10.181452+00:00	loop100 keep: raise standard br_tab to [1440,1123,970,890]	0.975503	40.0840	1.012952	0.952522	keep
677b26d	2026-04-05T11:32:05.103565+00:00	loop101 discard: raise standard br_tab to [1452,1133,978,898]	0.975505	40.0845	1.013673	0.952488	discard
a80aeb4	2026-04-05T11:32:43.681297+00:00	loop102 keep: raise standard br_tab to [1446,1128,974,894]	0.975504	40.0843	1.013318	0.952541	keep
a80aeb4	2026-04-05T11:33:28.949120+00:00	loop103 discard: raise standard br_tab to [1449,1130,976,896]	0.975504	40.0844	1.013493	0.952514	discard
a80aeb4	2026-04-05T11:34:33.225125+00:00	loop104 discard: tilt standard br_tab toward later entries [1444,1126,978,900]	0.975506	40.0846	1.013854	0.952464	discard
a80aeb4	2026-04-05T11:35:21.201902+00:00	loop105 discard: raise only standard br_tab tail to [1446,1128,976,896]	0.975504	40.0844	1.013493	0.952514	discard
1fa413d	2026-04-05T11:36:06.610699+00:00	loop106 keep: raise only standard br_tab front to [1449,1130,974,894]	0.975504	40.0843	1.013318	0.952541	keep
1fa413d	2026-04-05T11:36:49.415327+00:00	loop107 discard: raise standard br_tab front to [1452,1132,974,894]	0.975504	40.0843	1.013318	0.952541	discard
8dbc6b9	2026-04-05T11:37:48.543369+00:00	loop108 keep: firm lt luma corner further and raise lt br_tab slightly	0.975519	40.0850	1.012059	0.952720	keep
21e7522	2026-04-05T11:38:36.024923+00:00	loop109 keep: raise lt br_tab to [744,579,506,455]	0.975528	40.0891	1.013029	0.952830	keep
0b07335	2026-04-05T11:39:23.880119+00:00	loop110 keep: raise lt br_tab to [750,584,510,459]	0.975537	40.0912	1.013983	0.952956	keep
54bf3f9	2026-04-05T11:40:10.540448+00:00	loop111 keep: raise lt br_tab to [756,589,514,463]	0.975547	40.1009	1.014952	0.953062	keep
14717d4	2026-04-05T11:40:55.240943+00:00	loop112 keep: raise lt br_tab to [762,594,518,467]	0.975556	40.1006	1.015880	0.953180	keep
00318f4	2026-04-05T11:41:40.373533+00:00	loop113 keep: raise lt br_tab to [768,599,522,471]	0.975565	40.1077	1.016848	0.953292	keep
f3fcae2	2026-04-05T11:42:19.075098+00:00	loop114 keep: raise lt br_tab to [774,604,526,475]	0.975573	40.1145	1.017807	0.953393	keep
d17c252	2026-04-05T11:42:58.061141+00:00	loop115 keep: raise lt br_tab to [780,609,530,479]	0.975581	40.1124	1.018734	0.953513	keep
b3cf06b	2026-04-05T11:46:49.062592+00:00	loop116 keep: jump lt br_tab to [798,624,542,491]	0.975604	40.1297	1.021489	0.953840	keep
157ac1b	2026-04-05T11:47:25.968233+00:00	loop117 keep: jump lt br_tab to [816,639,554,503]	0.975629	40.1396	1.024279	0.954162	keep
3c3c4e0	2026-04-05T11:48:12.912304+00:00	loop118 keep: jump lt br_tab to [840,659,570,519]	0.975656	40.1516	1.027927	0.954569	keep
cd5d363	2026-04-05T11:49:01.590151+00:00	loop119 keep: jump lt br_tab to [876,689,594,543]	0.975695	40.1721	1.033218	0.954766	keep
98ba4c2	2026-04-05T11:49:41.577330+00:00	loop120 keep: jump lt br_tab to [930,734,630,579]	0.975744	40.1910	1.040601	0.954835	keep
98ba4c2	2026-04-05T11:50:27.583782+00:00	loop121 discard: jump lt br_tab to [1002,794,678,627]	0.975795	40.2088	1.049193	0.954213	discard
98ba4c2	2026-04-05T11:51:13.402959+00:00	loop122 discard: midpoint lt br_tab to [966,764,654,603]	0.975773	40.2014	1.045080	0.954706	discard
a7fe99a	2026-04-05T11:51:59.493251+00:00	loop123 keep: lower-midpoint lt br_tab to [948,749,642,591]	0.975759	40.1959	1.042857	0.954892	keep
a7fe99a	2026-04-05T11:52:41.676729+00:00	loop124 discard: upper-midpoint lt br_tab to [957,756,648,597]	0.975767	40.1984	1.043979	0.954846	discard
19a77f3	2026-04-05T11:53:21.119706+00:00	loop125 keep: raise lt br_tab to [952,752,645,594]	0.975763	40.1935	1.043410	0.954909	keep
19a77f3	2026-04-05T11:54:13.937364+00:00	loop126 discard: raise lt br_tab to [954,754,646,595]	0.975764	40.1950	1.043620	0.954887	discard
19a77f3	2026-04-05T11:55:02.255276+00:00	loop127 discard: raise lt PRORES_MB_LIMITS to 3000	0.975763	40.1935	1.043410	0.954909	discard
19a77f3	2026-04-05T11:56:22.777202+00:00	loop128 discard: lower mbs_per_slice to 4	0.975580	40.1626	1.101391	0.945100	discard
ef6716b	2026-04-05T11:57:06.269335+00:00	loop129 keep: soften lt luma high-frequency tail	0.975763	40.1937	1.043459	0.954916	keep
ef6716b	2026-04-05T11:57:52.459227+00:00	loop130 discard: soften lt chroma high-frequency tail	0.975763	40.1937	1.043459	0.954916	discard
ef6716b	2026-04-05T11:58:32.922397+00:00	loop131 discard: raise lt br_tab to [957,756,648,597] atop softer luma tail	0.975766	40.1986	1.044015	0.954849	discard
ef6716b	2026-04-05T11:59:24.824645+00:00	loop132 discard: lower lt br_tab to [948,749,642,591] atop softer luma tail	0.975759	40.1960	1.042901	0.954898	discard
ef6716b	2026-04-05T12:00:22.078485+00:00	loop133 discard: further soften lt luma high-frequency tail	0.975762	40.1930	1.043564	0.954911	discard
ef6716b	2026-04-05T12:01:25.675095+00:00	loop134 discard: partially revert lt luma tail softening	0.975763	40.1934	1.043429	0.954912	discard
ef6716b	2026-04-05T12:02:04.187882+00:00	loop135 discard: lower proxy br_tab to [370,298,270,238]	0.975739	40.1850	1.041994	0.954727	discard
ef6716b	2026-04-05T12:07:51.529495+00:00	loop136 discard: raise standard max_quant to 9	0.975765	40.1938	1.043468	0.954915	discard
91c27d4	2026-04-05T12:08:35.012144+00:00	loop137 keep: jump proxy br_tab to [396,318,288,254]	0.975827	40.2108	1.047686	0.955257	keep
91c27d4	2026-04-05T12:09:17.117126+00:00	loop138 discard: raise proxy PRORES_MB_LIMITS to 1800	0.975827	40.2108	1.047686	0.955257	discard
3d6b261	2026-04-05T12:09:58.745656+00:00	loop139 keep: jump proxy br_tab to [414,332,300,264]	0.975860	40.2178	1.050947	0.955473	keep
3d6b261	2026-04-05T12:10:39.092236+00:00	loop140 discard: jump proxy br_tab to [438,350,316,278]	0.975896	40.2281	1.055024	0.954995	discard
3d6b261	2026-04-05T12:11:22.407324+00:00	loop141 discard: midpoint proxy br_tab to [426,341,308,271]	0.975879	40.2247	1.053043	0.955223	discard
3d6b261	2026-04-05T12:12:01.955281+00:00	loop142 discard: raise lt max_quant to 10	0.975871	40.2185	1.051054	0.955463	discard
f9e3c80	2026-04-05T12:13:13.120272+00:00	loop143 keep: firm proxy luma low-frequency corner atop higher proxy br_tab	0.975844	40.2192	1.048111	0.955796	keep
f9e3c80	2026-04-05T12:13:59.431165+00:00	loop144 discard: raise proxy br_tab to [426,341,308,271] atop firmer luma corner	0.975863	40.2256	1.050151	0.955623	discard
f9e3c80	2026-04-05T12:14:52.865762+00:00	loop145 discard: raise proxy br_tab to [420,336,304,268] atop firmer luma corner	0.975853	40.2219	1.049290	0.955722	discard
7dce61b	2026-04-05T12:15:37.162025+00:00	loop146 keep: firm lt luma low-frequency corner atop softer tail	0.975848	40.2269	1.043966	0.956315	keep
a94951a	2026-04-05T12:16:33.900264+00:00	loop147 keep: extend firmer lt luma weighting into the next low-frequency band	0.975850	40.2280	1.042918	0.956513	keep
7d8f67f	2026-04-05T12:17:29.104218+00:00	loop148 keep: carry firmer lt luma weighting down the first two columns	0.975853	40.2331	1.041581	0.956767	keep
8a42df5	2026-04-05T12:18:22.771891+00:00	loop149 keep: extend firmer lt luma weighting into the lower-row third column	0.975854	40.2333	1.041460	0.956791	keep
82c1beb	2026-04-05T12:19:18.995399+00:00	loop150 keep: firm lt lower-row fourth coefficient band	0.975854	40.2335	1.041386	0.956793	keep
82c1beb	2026-04-05T12:22:26.252356+00:00	loop151 discard: lower lt br_tab to [930,734,630,579] atop firmer lt luma	0.975837	40.2257	1.038721	0.956705	discard
82c1beb	2026-04-05T12:23:11.149864+00:00	loop152 discard: lower only lt br_tab tail to [952,752,630,579]	0.975837	40.2257	1.038721	0.956705	discard
