commit	timestamp	description	score_version	development_score	holdout_score	overall_score	development_ssim_avg	development_video_bytes_ratio_avg	holdout_ssim_avg	holdout_video_bytes_ratio_avg	changed_files	status
007546b	2026-04-05T14:04:14.607632+00:00	baseline_phase2_v1_from_incumbent_114d26b	phase2_v1	0.958177	0.895194	0.945580	0.974432	1.019007	0.994259	1.415281	.gitignore,README.md,append_results.py,build.py,discard_experiment.py,evaluate.py,ffmpeg_overrides/libavcodec/proresdata.c,ffmpeg_overrides/libavcodec/proresenc_kostya.c,ffmpeg_overrides/libavcodec/proresenc_kostya_common.c,ffmpeg_overrides/libavcodec/proresenc_kostya_common.h,keep_experiment.py,meta/source_notes.md,patch_bases/proresdata.c.orig,patch_bases/proresenc_kostya_common.h.orig,phase2_policy.py,prepare.py,program.md,projectlib.py	baseline
007546b	2026-04-05T14:10:54.725946+00:00	rate_penalty_bits_128_patch_target_conflict	phase2_v1	0.000000	0.000000	0.000000	0.000000	0.000000	0.000000	0.000000	ffmpeg_overrides/libavcodec/proresenc_kostya.c	crash
007546b	2026-04-05T14:12:12.882095+00:00	trellis_rate_penalty_bits_128_too_small_to_keep	phase2_v1	0.958177	0.895197	0.945581	0.974432	1.019005	0.994259	1.415268	ffmpeg_overrides/libavcodec/proresenc_kostya.c	discard
377ca71	2026-04-05T14:13:16.679436+00:00	trellis_rate_penalty_bits_64	phase2_v1	0.958179	0.895199	0.945583	0.974432	1.018996	0.994259	1.415260	ffmpeg_overrides/libavcodec/proresenc_kostya.c	keep
377ca71	2026-04-05T14:14:13.232190+00:00	trellis_rate_penalty_bits_48_too_small	phase2_v1	0.958179	0.895200	0.945583	0.974432	1.018994	0.994259	1.415257	ffmpeg_overrides/libavcodec/proresenc_kostya.c	discard
377ca71	2026-04-05T14:15:08.864619+00:00	trellis_rate_penalty_bits_32_too_small	phase2_v1	0.958180	0.895202	0.945584	0.974432	1.018988	0.994259	1.415245	ffmpeg_overrides/libavcodec/proresenc_kostya.c	discard
377ca71	2026-04-05T14:16:06.634630+00:00	trellis_quant_jump_penalty_4	phase2_v1	0.958110	0.895200	0.945528	0.974411	1.019526	0.994259	1.415258	ffmpeg_overrides/libavcodec/proresenc_kostya.c	discard
377ca71	2026-04-05T14:16:56.782842+00:00	luma_error_weight_95	phase2_v1	0.958158	0.895201	0.945566	0.974411	1.018995	0.994259	1.415252	encoder_params.py	discard
377ca71	2026-04-05T14:17:50.542752+00:00	chroma_error_weight_110	phase2_v1	0.958174	0.895195	0.945578	0.974432	1.019011	0.994259	1.415279	encoder_params.py	discard
377ca71	2026-04-05T14:18:42.028956+00:00	lt_br_tab_minus_2p5pct	phase2_v1	0.957769	0.896559	0.945527	0.974417	1.016847	0.994243	1.408208	encoder_params.py	discard
c0f6add	2026-04-05T14:19:40.550084+00:00	lt_1080p_br_tab_590	phase2_v1	0.958086	0.895577	0.945584	0.974428	1.018365	0.994255	1.413288	encoder_params.py	keep
c0f6add	2026-04-05T14:20:32.036648+00:00	lt_1080p_br_tab_588	phase2_v1	0.958024	0.895773	0.945574	0.974426	1.018072	0.994252	1.412265	encoder_params.py	discard
c0f6add	2026-04-05T14:21:19.289876+00:00	lt_1080p_br_tab_589	phase2_v1	0.958055	0.895675	0.945579	0.974427	1.018219	0.994253	1.412779	encoder_params.py	discard
7652989	2026-04-05T14:23:01.190220+00:00	trellis_soft_budget_headroom	phase2_v1	0.958087	0.895589	0.945587	0.974428	1.018345	0.994255	1.413232	ffmpeg_overrides/libavcodec/proresenc_kostya.c	keep
6f82254	2026-04-05T14:24:32.917536+00:00	overquant_lookahead_best_fit	phase2_v1	0.958089	0.895589	0.945589	0.974427	1.018307	0.994254	1.413228	ffmpeg_overrides/libavcodec/proresenc_kostya.c	keep
6f82254	2026-04-05T14:26:21.566152+00:00	adaptive_chroma_quant_hard_slices	phase2_v1	0.957329	0.895404	0.944944	0.973770	1.017644	0.993844	1.412316	ffmpeg_overrides/libavcodec/proresenc_kostya.c	discard
6f82254	2026-04-05T14:28:16.765798+00:00	rounded_low_freq_ac_levels	phase2_v1	0.957089	0.892170	0.944106	0.974514	1.037868	0.994403	1.431195	ffmpeg_overrides/libavcodec/proresenc_kostya.c	discard
e75b1f1	2026-04-05T14:29:17.293735+00:00	dynamic_row_headroom	phase2_v1	0.958091	0.895592	0.945591	0.974427	1.018292	0.994255	1.413216	ffmpeg_overrides/libavcodec/proresenc_kostya.c	keep
e75b1f1	2026-04-05T14:30:12.652038+00:00	overquant_lookahead_two_steps	phase2_v1	0.958090	0.895592	0.945591	0.974426	1.018286	0.994255	1.413216	ffmpeg_overrides/libavcodec/proresenc_kostya.c	discard
e75b1f1	2026-04-05T14:31:23.721949+00:00	downward_quant_jump_penalty	phase2_v1	0.958001	0.895592	0.945519	0.974405	1.018716	0.994255	1.413213	ffmpeg_overrides/libavcodec/proresenc_kostya.c	discard
e75b1f1	2026-04-05T14:32:24.235986+00:00	overquant_soft_slice_headroom	phase2_v1	0.958091	0.895592	0.945591	0.974427	1.018292	0.994255	1.413216	ffmpeg_overrides/libavcodec/proresenc_kostya.c	discard
38c492d	2026-04-05T14:33:26.648964+00:00	dynamic_row_headroom_penalty12	phase2_v1	0.958091	0.895601	0.945593	0.974427	1.018279	0.994255	1.413172	ffmpeg_overrides/libavcodec/proresenc_kostya.c	keep
1317d75	2026-04-05T14:34:25.517844+00:00	dynamic_row_headroom_penalty10	phase2_v1	0.958092	0.895608	0.945595	0.974427	1.018272	0.994255	1.413143	ffmpeg_overrides/libavcodec/proresenc_kostya.c	keep
2cd0953	2026-04-05T14:35:21.322486+00:00	dynamic_row_headroom_penalty8	phase2_v1	0.958092	0.895620	0.945598	0.974427	1.018259	0.994255	1.413087	ffmpeg_overrides/libavcodec/proresenc_kostya.c	keep
dc87d78	2026-04-05T14:36:18.979602+00:00	dynamic_row_headroom_penalty6	phase2_v1	0.958094	0.895635	0.945602	0.974427	1.018237	0.994255	1.413011	ffmpeg_overrides/libavcodec/proresenc_kostya.c	keep
5691838	2026-04-05T14:37:18.983100+00:00	dynamic_row_headroom_penalty4	phase2_v1	0.958096	0.895666	0.945610	0.974427	1.018190	0.994256	1.412872	ffmpeg_overrides/libavcodec/proresenc_kostya.c	keep
58459aa	2026-04-05T14:40:04.151097+00:00	profile_aware_lt_standard_budget_pressure	phase2_v1	0.958093	0.895683	0.945611	0.974427	1.018170	0.994256	1.412786	ffmpeg_overrides/libavcodec/proresenc_kostya.c	keep
58459aa	2026-04-05T14:41:09.572633+00:00	standard_more_aggressive_than_lt_too_small	phase2_v1	0.958089	0.895702	0.945612	0.974427	1.018150	0.994256	1.412688	ffmpeg_overrides/libavcodec/proresenc_kostya.c	discard
58459aa	2026-04-05T14:42:16.503255+00:00	profile_split_budget_pressure_looser_proxy_hq	phase2_v1	0.958087	0.895685	0.945607	0.974427	1.018168	0.994256	1.412759	ffmpeg_overrides/libavcodec/proresenc_kostya.c	discard
58459aa	2026-04-05T14:43:18.158077+00:00	profile_aware_overquant_soft_headroom	phase2_v1	0.958093	0.895683	0.945611	0.974427	1.018170	0.994256	1.412786	ffmpeg_overrides/libavcodec/proresenc_kostya.c	discard
58459aa	2026-04-05T14:44:12.727877+00:00	profile_aware_lt_standard_rate_bias	phase2_v1	0.958093	0.895683	0.945611	0.974427	1.018169	0.994256	1.412785	ffmpeg_overrides/libavcodec/proresenc_kostya.c	discard
58459aa	2026-04-05T14:46:02.838422+00:00	proactive_overquant_lt_standard_noise_only	phase2_v1	0.958093	0.895683	0.945611	0.974427	1.018170	0.994256	1.412785	ffmpeg_overrides/libavcodec/proresenc_kostya.c	discard
58459aa	2026-04-05T14:47:06.152423+00:00	lt_stronger_than_standard_budget_pressure	phase2_v1	0.958091	0.895694	0.945611	0.974427	1.018151	0.994257	1.412734	ffmpeg_overrides/libavcodec/proresenc_kostya.c	discard
58459aa	2026-04-05T14:48:04.254785+00:00	lt_standard_larger_row_reserve_cap	phase2_v1	0.958092	0.895686	0.945611	0.974427	1.018156	0.994256	1.412768	ffmpeg_overrides/libavcodec/proresenc_kostya.c	discard
47b8c0b	2026-04-05T14:49:07.653706+00:00	piecewise_soft_limit_penalty	phase2_v1	0.958098	0.895772	0.945633	0.974428	1.017988	0.994261	1.412380	ffmpeg_overrides/libavcodec/proresenc_kostya.c	keep
e898828	2026-04-05T14:50:13.885573+00:00	piecewise_soft_limit_penalty_early_trigger	phase2_v1	0.958100	0.895788	0.945638	0.974428	1.017969	0.994261	1.412308	ffmpeg_overrides/libavcodec/proresenc_kostya.c	keep
8cf02d1	2026-04-05T14:51:14.196666+00:00	piecewise_soft_limit_penalty_trigger12	phase2_v1	0.958103	0.895798	0.945642	0.974428	1.017954	0.994261	1.412259	ffmpeg_overrides/libavcodec/proresenc_kostya.c	keep
cd00db3	2026-04-05T14:52:12.262552+00:00	piecewise_soft_limit_penalty_trigger14	phase2_v1	0.958105	0.895807	0.945645	0.974428	1.017948	0.994260	1.412218	ffmpeg_overrides/libavcodec/proresenc_kostya.c	keep
7f05c28	2026-04-05T14:53:20.628583+00:00	piecewise_soft_limit_penalty_trigger16	phase2_v1	0.958106	0.895811	0.945647	0.974427	1.017938	0.994260	1.412200	ffmpeg_overrides/libavcodec/proresenc_kostya.c	keep
7f05c28	2026-04-05T15:27:31.046864+00:00	piecewise_soft_limit_penalty_trigger18_too_small	phase2_v1	0.958106	0.895814	0.945648	0.974427	1.017931	0.994260	1.412183	ffmpeg_overrides/libavcodec/proresenc_kostya.c	discard
0a29574	2026-04-05T15:28:51.664793+00:00	piecewise_soft_limit_steeper_second_slope	phase2_v1	0.958124	0.895910	0.945681	0.974426	1.017762	0.994262	1.411743	ffmpeg_overrides/libavcodec/proresenc_kostya.c	keep
03c3a26	2026-04-05T15:45:29.982085+00:00	piecewise_soft_limit_very_steep_second_slope	phase2_v1	0.958345	0.896560	0.945988	0.974424	1.016226	0.994267	1.408503	ffmpeg_overrides/libavcodec/proresenc_kostya.c	keep
be5a32c	2026-04-05T15:46:44.664285+00:00	piecewise_soft_limit_max_steep_second_slope	phase2_v1	0.958485	0.896845	0.946157	0.974423	1.015222	0.994270	1.407258	ffmpeg_overrides/libavcodec/proresenc_kostya.c	keep
cc5e86f	2026-04-05T15:48:12.395276+00:00	lt_standard_stronger_first_slope	phase2_v1	0.958484	0.897084	0.946204	0.974422	1.014822	0.994271	1.406037	ffmpeg_overrides/libavcodec/proresenc_kostya.c	keep
877c011	2026-04-05T16:05:51.243620+00:00	lt_standard_stronger_row_reserve	phase2_v1	0.958484	0.897171	0.946221	0.974422	1.014818	0.994271	1.405592	ffmpeg_overrides/libavcodec/proresenc_kostya.c	keep
d7ddd93	2026-04-05T16:07:34.260225+00:00	lt_standard_large_reserve_cap_with_strong_slopes	phase2_v1	0.958521	0.898610	0.946539	0.974418	1.012626	0.994276	1.398266	ffmpeg_overrides/libavcodec/proresenc_kostya.c	keep
d518131	2026-04-05T16:09:03.047111+00:00	lt_standard_full_reserve_cap	phase2_v1	0.958410	0.900299	0.946788	0.974411	1.009503	0.994277	1.389742	ffmpeg_overrides/libavcodec/proresenc_kostya.c	keep
80f92bd	2026-04-05T16:10:24.175304+00:00	lt_standard_max_remaining_budget_pressure	phase2_v1	0.958408	0.900795	0.946886	0.974410	1.009435	0.994275	1.387247	ffmpeg_overrides/libavcodec/proresenc_kostya.c	keep
80f92bd	2026-04-05T16:12:06.681327+00:00	proxy_first_slope_pressure_no_gain	phase2_v1	0.958408	0.900795	0.946886	0.974410	1.009435	0.994275	1.387245	ffmpeg_overrides/libavcodec/proresenc_kostya.c	discard
80f92bd	2026-04-05T16:13:29.383131+00:00	lt_standard_first_slope_floor_too_far	phase2_v1	0.958112	0.901748	0.946840	0.974399	1.006307	0.994270	1.382492	ffmpeg_overrides/libavcodec/proresenc_kostya.c	discard
7efe4fa	2026-04-05T16:15:02.681960+00:00	lt_floor_first_slope_standard_preserved	phase2_v1	0.958381	0.901236	0.946952	0.974408	1.008048	0.994272	1.385033	ffmpeg_overrides/libavcodec/proresenc_kostya.c	keep
1c9a4ed	2026-04-05T16:18:34.288011+00:00	proxy_row_budget_pressure_bundle	phase2_v1	0.958389	0.901239	0.946959	0.974407	1.008006	0.994272	1.385021	ffmpeg_overrides/libavcodec/proresenc_kostya.c	keep
dcfe11f	2026-04-05T16:19:59.610660+00:00	hq_row_budget_pressure_bundle	phase2_v1	0.958588	0.902173	0.947305	0.974398	1.005239	0.994268	1.380925	ffmpeg_overrides/libavcodec/proresenc_kostya.c	keep
1de0a67	2026-04-05T16:21:55.940789+00:00	proxy_stronger_row_budget_pressure	phase2_v1	0.958590	0.902178	0.947308	0.974398	1.005205	0.994268	1.380901	ffmpeg_overrides/libavcodec/proresenc_kostya.c	keep
1de0a67	2026-04-05T16:23:18.989779+00:00	hq_stronger_row_budget_pressure_too_far	phase2_v1	0.957994	0.903843	0.947163	0.974402	1.001191	0.994255	1.373690	ffmpeg_overrides/libavcodec/proresenc_kostya.c	discard
13cc51e	2026-04-05T16:24:56.783629+00:00	lt_earlier_second_slope_trigger	phase2_v1	0.958602	0.902205	0.947323	0.974398	1.005107	0.994268	1.380763	ffmpeg_overrides/libavcodec/proresenc_kostya.c	keep
74f4a4d	2026-04-05T16:26:24.811792+00:00	standard_earlier_second_slope_trigger	phase2_v1	0.958595	0.902246	0.947325	0.974398	1.005030	0.994268	1.380558	ffmpeg_overrides/libavcodec/proresenc_kostya.c	keep
74f4a4d	2026-04-05T16:27:48.015841+00:00	proxy_earlier_second_slope_too_small	phase2_v1	0.958595	0.902247	0.947325	0.974398	1.005030	0.994268	1.380556	ffmpeg_overrides/libavcodec/proresenc_kostya.c	discard
74f4a4d	2026-04-05T16:29:14.293457+00:00	hq_earlier_second_slope_too_far	phase2_v1	0.958501	0.902290	0.947259	0.974408	1.004595	0.994268	1.380368	ffmpeg_overrides/libavcodec/proresenc_kostya.c	discard
74f4a4d	2026-04-05T16:30:36.638223+00:00	profile_aware_base_rate_term_no_gain	phase2_v1	0.958593	0.902253	0.947325	0.974397	1.005016	0.994268	1.380524	ffmpeg_overrides/libavcodec/proresenc_kostya.c	discard
15cecce	2026-04-05T16:52:40.213479+00:00	lt_standard_even_earlier_second_slope	phase2_v1	0.958595	0.902291	0.947334	0.974397	1.004953	0.994268	1.380335	ffmpeg_overrides/libavcodec/proresenc_kostya.c	keep
3503f72	2026-04-05T17:11:20.505982+00:00	lt_standard_trigger28	phase2_v1	0.958593	0.902318	0.947338	0.974397	1.004902	0.994267	1.380197	ffmpeg_overrides/libavcodec/proresenc_kostya.c	keep
87fd2f0	2026-04-05T17:45:08.892181+00:00	lt_standard_trigger32	phase2_v1	0.958590	0.902341	0.947340	0.974397	1.004861	0.994268	1.380084	ffmpeg_overrides/libavcodec/proresenc_kostya.c	keep
b006625	2026-04-05T18:10:18.453111+00:00	lt_standard_trigger40	phase2_v1	0.958586	0.902376	0.947344	0.974397	1.004807	0.994267	1.379906	ffmpeg_overrides/libavcodec/proresenc_kostya.c	keep
b006625	2026-04-05T18:44:05.922054+00:00	standard_first_slope_floor_too_far_again	phase2_v1	0.958333	0.902871	0.947241	0.974388	1.003101	0.994266	1.377457	ffmpeg_overrides/libavcodec/proresenc_kostya.c	discard
e8f54bd	2026-04-05T18:59:12.204037+00:00	proxy_first_slope_floor	phase2_v1	0.958591	0.902404	0.947354	0.974397	1.004720	0.994268	1.379773	ffmpeg_overrides/libavcodec/proresenc_kostya.c	keep
e8f54bd	2026-04-05T19:00:06.992984+00:00	hq_first_slope_floor_too_far	phase2_v1	0.958400	0.902540	0.947228	0.974412	1.003809	0.994262	1.379158	ffmpeg_overrides/libavcodec/proresenc_kostya.c	discard
e8f54bd	2026-04-05T19:03:22.935331+00:00	profile_aware_overquant_softfit_window	phase2_v1	0.958590	0.902404	0.947353	0.974396	1.004712	0.994268	1.379773	ffmpeg_overrides/libavcodec/proresenc_kostya.c	discard
3c8c3bd	2026-04-05T19:04:50.754640+00:00	lt_standard_proxy_multi_slice_reserve	phase2_v1	0.958650	0.904268	0.947774	0.974395	0.999824	0.994262	1.370522	ffmpeg_overrides/libavcodec/proresenc_kostya.c	keep
a190703	2026-04-05T19:05:47.625707+00:00	lt_standard_deeper_multi_slice_reserve	phase2_v1	0.958194	0.906172	0.947790	0.974388	0.995390	0.994251	1.361178	ffmpeg_overrides/libavcodec/proresenc_kostya.c	keep
a190703	2026-04-05T19:06:41.092693+00:00	proxy_deeper_multi_slice_reserve	phase2_v1	0.958189	0.906185	0.947788	0.974388	0.995352	0.994251	1.361115	ffmpeg_overrides/libavcodec/proresenc_kostya.c	discard
a190703	2026-04-05T19:07:43.598514+00:00	lt_standard_softer_second_slope_under_deeper_reserve	phase2_v1	0.959171	0.904046	0.948146	0.974399	1.001515	0.994286	1.371687	ffmpeg_overrides/libavcodec/proresenc_kostya.c	discard
a190703	2026-04-05T19:08:48.808583+00:00	proxy_earlier_second_slope_under_deeper_reserve_noise	phase2_v1	0.958195	0.906174	0.947790	0.974388	0.995383	0.994251	1.361168	ffmpeg_overrides/libavcodec/proresenc_kostya.c	discard
d1f211a	2026-04-05T19:09:47.072252+00:00	lt_extra_reserve_above_standard	phase2_v1	0.958269	0.907089	0.948033	0.974386	0.993325	0.994248	1.356725	ffmpeg_overrides/libavcodec/proresenc_kostya.c	keep
94ff6f5	2026-04-05T19:10:48.920785+00:00	lt_two_slice_reserve	phase2_v1	0.958431	0.907991	0.948343	0.974383	0.991253	0.994243	1.352400	ffmpeg_overrides/libavcodec/proresenc_kostya.c	keep
94ff6f5	2026-04-05T19:11:44.196938+00:00	standard_extra_reserve_above_current_stack	phase2_v1	0.957859	0.909111	0.948109	0.974378	0.989239	0.994235	1.346993	ffmpeg_overrides/libavcodec/proresenc_kostya.c	discard
5ac3071	2026-04-05T22:11:42.021693+00:00	apple_matrix_reset_chroma_scale_too_blunt	phase2_v1	0.955032	0.899405	0.943907	0.975866	1.049469	0.995179	1.399280	encoder_params.py	discard
5ac3071	2026-04-05T22:18:07.368458+00:00	apple_luma_gated_row_floor_still_too_strong	phase2_v1	0.918047	0.942455	0.922928	0.972704	0.859866	0.993044	1.147320	discard_experiment.py,encoder_params.py,ffmpeg_overrides/libavcodec/proresenc_kostya.c,results_v2.tsv	discard
87754d6	2026-04-05T22:34:28.484257+00:00	profile_aware_base_rate_pressure	phase2_v1	0.958425	0.908016	0.948343	0.974383	0.991187	0.994243	1.352278	discard_experiment.py,ffmpeg_overrides/libavcodec/proresenc_kostya.c,keep_experiment.py,results_v2.tsv	keep
87754d6	2026-04-05T22:35:53.107741+00:00	apple_lt_standard_luma_on_rate_pressure_base	phase2_v1	0.956507	0.903840	0.945974	0.973699	1.022308	0.994193	1.372336	encoder_params.py,results_v2.tsv	discard
995861d	2026-04-05T22:37:52.502978+00:00	profile_aware_base_rate_pressure_proxy20	phase2_v1	0.958426	0.908017	0.948344	0.974383	0.991182	0.994243	1.352275	ffmpeg_overrides/libavcodec/proresenc_kostya.c,results_v2.tsv	keep
b9e3cc4	2026-04-05T22:38:51.713556+00:00	profile_aware_base_rate_pressure_proxy16	phase2_v1	0.958426	0.908018	0.948345	0.974383	0.991176	0.994243	1.352272	ffmpeg_overrides/libavcodec/proresenc_kostya.c,results_v2.tsv	keep
